{
  "schemaVersion": "0.1.0",
  "profileId": "thimfora-79.chart-2",
  "revision": "0.1.0",
  "normalization": "none",
  "offsetUnit": "unicode-scalar",
  "unknownPolicy": "preserve",
  "fontSha256s": [
    "182d49f4e1677afd607696ad9506fbdb377e6d1d77fd5e53974ca74a0d378325",
    "2e195f255b0f53042a0a05b693f94bafa41505dbaab475d7379549ccdaff59dd",
    "a9bb4075285df9acf2bf75c08446d44cfd83b29f6940937671cc07bd68f9f6cc"
  ],
  "inventory": [
    {
      "symbolId": "thimfora.letter.001",
      "kind": "letter",
      "ordinal": 1,
      "nameTranscription": "j\u012bam",
      "nameConfidence": "medium",
      "transliterationStatus": "transcribed",
      "transliterationNote": null,
      "evidence": [
        {
          "asset": {
            "assetId": "asset:98b78f2586b894c648f580baa6d9ebd95646e28b6c166e9394dee1db9b554922",
            "path": "Origins_2_Thimfora_2.jpg",
            "sha256": "fabc2608b23926a51b833756f015fa430993de63ee4c4d0773ecaf5e405748c7"
          },
          "locator": "left column, row 1",
          "method": "visual-chart-transcription"
        }
      ]
    },
    {
      "symbolId": "thimfora.letter.002",
      "kind": "letter",
      "ordinal": 2,
      "nameTranscription": "jzhad",
      "nameConfidence": "medium",
      "transliterationStatus": "transcribed",
      "transliterationNote": null,
      "evidence": [
        {
          "asset": {
            "assetId": "asset:98b78f2586b894c648f580baa6d9ebd95646e28b6c166e9394dee1db9b554922",
            "path": "Origins_2_Thimfora_2.jpg",
            "sha256": "fabc2608b23926a51b833756f015fa430993de63ee4c4d0773ecaf5e405748c7"
          },
          "locator": "left column, row 2",
          "method": "visual-chart-transcription"
        }
      ]
    },
    {
      "symbolId": "thimfora.letter.003",
      "kind": "letter",
      "ordinal": 3,
      "nameTranscription": "k\u0113hta",
      "nameConfidence": "medium",
      "transliterationStatus": "transcribed",
      "transliterationNote": null,
      "evidence": [
        {
          "asset": {
            "assetId": "asset:98b78f2586b894c648f580baa6d9ebd95646e28b6c166e9394dee1db9b554922",
            "path": "Origins_2_Thimfora_2.jpg",
            "sha256": "fabc2608b23926a51b833756f015fa430993de63ee4c4d0773ecaf5e405748c7"
          },
          "locator": "left column, row 3",
          "method": "visual-chart-transcription"
        }
      ]
    },
    {
      "symbolId": "thimfora.letter.004",
      "kind": "letter",
      "ordinal": 4,
      "nameTranscription": "\u0101der",
      "nameConfidence": "medium",
      "transliterationStatus": "transcribed",
      "transliterationNote": null,
      "evidence": [
        {
          "asset": {
            "assetId": "asset:98b78f2586b894c648f580baa6d9ebd95646e28b6c166e9394dee1db9b554922",
            "path": "Origins_2_Thimfora_2.jpg",
            "sha256": "fabc2608b23926a51b833756f015fa430993de63ee4c4d0773ecaf5e405748c7"
          },
          "locator": "left column, row 4",
          "method": "visual-chart-transcription"
        }
      ]
    },
    {
      "symbolId": "thimfora.letter.005",
      "kind": "letter",
      "ordinal": 5,
      "nameTranscription": "alna",
      "nameConfidence": "medium",
      "transliterationStatus": "transcribed",
      "transliterationNote": null,
      "evidence": [
        {
          "asset": {
            "assetId": "asset:98b78f2586b894c648f580baa6d9ebd95646e28b6c166e9394dee1db9b554922",
            "path": "Origins_2_Thimfora_2.jpg",
            "sha256": "fabc2608b23926a51b833756f015fa430993de63ee4c4d0773ecaf5e405748c7"
          },
          "locator": "left column, row 5",
          "method": "visual-chart-transcription"
        }
      ]
    },
    {
      "symbolId": "thimfora.letter.006",
      "kind": "letter",
      "ordinal": 6,
      "nameTranscription": "\u0101m\u0113en",
      "nameConfidence": "medium",
      "transliterationStatus": "transcribed",
      "transliterationNote": null,
      "evidence": [
        {
          "asset": {
            "assetId": "asset:98b78f2586b894c648f580baa6d9ebd95646e28b6c166e9394dee1db9b554922",
            "path": "Origins_2_Thimfora_2.jpg",
            "sha256": "fabc2608b23926a51b833756f015fa430993de63ee4c4d0773ecaf5e405748c7"
          },
          "locator": "left column, row 6",
          "method": "visual-chart-transcription"
        }
      ]
    },
    {
      "symbolId": "thimfora.letter.007",
      "kind": "letter",
      "ordinal": 7,
      "nameTranscription": "\u0101thus",
      "nameConfidence": "medium",
      "transliterationStatus": "transcribed",
      "transliterationNote": null,
      "evidence": [
        {
          "asset": {
            "assetId": "asset:98b78f2586b894c648f580baa6d9ebd95646e28b6c166e9394dee1db9b554922",
            "path": "Origins_2_Thimfora_2.jpg",
            "sha256": "fabc2608b23926a51b833756f015fa430993de63ee4c4d0773ecaf5e405748c7"
          },
          "locator": "left column, row 7",
          "method": "visual-chart-transcription"
        }
      ]
    },
    {
      "symbolId": "thimfora.letter.008",
      "kind": "letter",
      "ordinal": 8,
      "nameTranscription": "haxt",
      "nameConfidence": "medium",
      "transliterationStatus": "transcribed",
      "transliterationNote": null,
      "evidence": [
        {
          "asset": {
            "assetId": "asset:98b78f2586b894c648f580baa6d9ebd95646e28b6c166e9394dee1db9b554922",
            "path": "Origins_2_Thimfora_2.jpg",
            "sha256": "fabc2608b23926a51b833756f015fa430993de63ee4c4d0773ecaf5e405748c7"
          },
          "locator": "left column, row 8",
          "method": "visual-chart-transcription"
        }
      ]
    },
    {
      "symbolId": "thimfora.letter.009",
      "kind": "letter",
      "ordinal": 9,
      "nameTranscription": "h\u00e3r\u00fcx",
      "nameConfidence": "medium",
      "transliterationStatus": "transcribed",
      "transliterationNote": null,
      "evidence": [
        {
          "asset": {
            "assetId": "asset:98b78f2586b894c648f580baa6d9ebd95646e28b6c166e9394dee1db9b554922",
            "path": "Origins_2_Thimfora_2.jpg",
            "sha256": "fabc2608b23926a51b833756f015fa430993de63ee4c4d0773ecaf5e405748c7"
          },
          "locator": "left column, row 9",
          "method": "visual-chart-transcription"
        }
      ]
    },
    {
      "symbolId": "thimfora.letter.010",
      "kind": "letter",
      "ordinal": 10,
      "nameTranscription": "ra",
      "nameConfidence": "medium",
      "transliterationStatus": "transcribed",
      "transliterationNote": null,
      "evidence": [
        {
          "asset": {
            "assetId": "asset:98b78f2586b894c648f580baa6d9ebd95646e28b6c166e9394dee1db9b554922",
            "path": "Origins_2_Thimfora_2.jpg",
            "sha256": "fabc2608b23926a51b833756f015fa430993de63ee4c4d0773ecaf5e405748c7"
          },
          "locator": "left column, row 10",
          "method": "visual-chart-transcription"
        }
      ]
    },
    {
      "symbolId": "thimfora.letter.011",
      "kind": "letter",
      "ordinal": 11,
      "nameTranscription": "ren",
      "nameConfidence": "medium",
      "transliterationStatus": "transcribed",
      "transliterationNote": null,
      "evidence": [
        {
          "asset": {
            "assetId": "asset:98b78f2586b894c648f580baa6d9ebd95646e28b6c166e9394dee1db9b554922",
            "path": "Origins_2_Thimfora_2.jpg",
            "sha256": "fabc2608b23926a51b833756f015fa430993de63ee4c4d0773ecaf5e405748c7"
          },
          "locator": "left column, row 11",
          "method": "visual-chart-transcription"
        }
      ]
    },
    {
      "symbolId": "thimfora.letter.012",
      "kind": "letter",
      "ordinal": 12,
      "nameTranscription": "ris",
      "nameConfidence": "medium",
      "transliterationStatus": "unresolved",
      "transliterationNote": "The chart uses a reversed-e form plus r. Exact Unicode correspondence needs confirmation; legacy slots and symbol identity are verified.",
      "evidence": [
        {
          "asset": {
            "assetId": "asset:98b78f2586b894c648f580baa6d9ebd95646e28b6c166e9394dee1db9b554922",
            "path": "Origins_2_Thimfora_2.jpg",
            "sha256": "fabc2608b23926a51b833756f015fa430993de63ee4c4d0773ecaf5e405748c7"
          },
          "locator": "left column, row 12",
          "method": "visual-chart-transcription"
        }
      ]
    },
    {
      "symbolId": "thimfora.letter.013",
      "kind": "letter",
      "ordinal": 13,
      "nameTranscription": "bart\u00e4",
      "nameConfidence": "medium",
      "transliterationStatus": "transcribed",
      "transliterationNote": null,
      "evidence": [
        {
          "asset": {
            "assetId": "asset:98b78f2586b894c648f580baa6d9ebd95646e28b6c166e9394dee1db9b554922",
            "path": "Origins_2_Thimfora_2.jpg",
            "sha256": "fabc2608b23926a51b833756f015fa430993de63ee4c4d0773ecaf5e405748c7"
          },
          "locator": "left column, row 13",
          "method": "visual-chart-transcription"
        }
      ]
    },
    {
      "symbolId": "thimfora.letter.014",
      "kind": "letter",
      "ordinal": 14,
      "nameTranscription": "s\u0113t\u014d",
      "nameConfidence": "medium",
      "transliterationStatus": "transcribed",
      "transliterationNote": null,
      "evidence": [
        {
          "asset": {
            "assetId": "asset:98b78f2586b894c648f580baa6d9ebd95646e28b6c166e9394dee1db9b554922",
            "path": "Origins_2_Thimfora_2.jpg",
            "sha256": "fabc2608b23926a51b833756f015fa430993de63ee4c4d0773ecaf5e405748c7"
          },
          "locator": "left column, row 14",
          "method": "visual-chart-transcription"
        }
      ]
    },
    {
      "symbolId": "thimfora.letter.015",
      "kind": "letter",
      "ordinal": 15,
      "nameTranscription": "karthon",
      "nameConfidence": "medium",